<?xml version="1.0"?>
<!DOCTYPE file SYSTEM "file_format.dtd">
<file name="Image catalog files">

<globs>
	<glob filespec="*.imc" />
</globs>

<description type="paragraph">
	Battle sprites animation catalogue.
	Contains 72 frames for walking (WK) or combat (CB) or 16 frames for dying sequence (DY).
	Entire .IMC file is compressed using DL variant od RLE. (see reader_drle.py)
	<html:em>Next passages are describing contents of decompressed file.</html:em>
</description>

<offsets>
	<offset start="0x00">

		<array at="0x00" size="24" unknown="yes">
			<description>Looks like pairs of words. Small numbers. Y/X frame offsets maybe.</description>
			<byte />
		</array>

		<byte at="25" unknown="yes">
			<description>0xff for DY files, 0x0 for other</description>
		</byte>

        <array at="26" size="20" unknown="yes">
            <description>Unknown data. Present only in non-DY files.</description>
            <notes>
                <note>Looks like motion-related. All zeroes for static monsters (M73, M90).</note>
            </notes>
            <byte />
        </array>

		<word at="26/46" name="sprite_height">
			<description>Height of sprite (height of all frames is same)</description>
		</word>

		<array at="28/48" size="8" name="sprite_widths">
			<description>Sprite widths for 8 directions (frames in one direction are having the same width)</description>
			<word />
		</array>

        <array at="44/64" size="16" unknown="yes">
            <description>8 words? Also direction related?</description>
            <byte />
        </array>

		<word at="60/80" name="frame_count">
			<description>Frame count for one direction. File contains 8 * frame_count images.</description>
		</word>

		<word at="62/82" name="data_length">
			<description>Size of the rest of the file beyond the frame offsets.</description>
		</word>

		<array at="64/84" size="variable" name="frame_data_offsets">
			<description>Offsets of frame data</description>
			<notes>
				<note>Starting beyond the end of this array</note>
				<note>Divided by 16 for reason unknown. (so 'end+offset*16' is the start of frame data)</note>
			</notes>
			<word />
		</array>


	</offset>

</offsets>

<!-- ====================================================================== -->

<structdefs>
	<structdef type="frame" size="">

		<byte at="0x00" name="width">
			<description>Width of image</description>
		</byte>
		<byte at="0x01" name="height">
			<description>Height of image</description>
		</byte>

		<array at="0x02" size="variable" name="image_data">
			<byte />
			<description>Encoded image data</description>
			<notes>
				<note>Each row of image starts with byte containing count of defined pixels.</note>
				<note>Next byte containing count of starting empty pixels.</note>
				<note>Then follows count_of_defined_pixels long sequence of pixels (pallete index bytes) to be rendered. (zero is transparent)</note>
				<note></note>
				<note></note>
			</notes>
		</array>
	</structdef>
</structdefs>

</file>
